{
  "apiVersion": "lz.platformrelay.dev/v1alpha1",
  "kind": "StageOutputs",
  "instance_id": "demo-state",
  "stage": "tenant-state",
  "source_revision": "0d1e2f3a4b5c6d7e8f90a1b2c3d4e5f60718293a",
  "values": {
    "tenant": "demo",
    "state_bucket": "lz-demo-bkt-state",
    "tenant_s3_user_id": "4712",
    "platform_s3_user_id": "4713",
    "unlabelled": [
      "module.state_backend.ovh_cloud_project_user.s3[\"tenant\"]",
      "module.state_backend.ovh_cloud_project_user.s3[\"platform\"]"
    ]
  }
}
